type	location	adress	city	Phone-number	fax 	website	email	additional-information
British Embassy	Brasilia, Brazil	Setor de Embaixadas Sul, Quadra 801, Lote 8, CEP 70408-900 Brasilia , Brazil	City Brasilia	+55 (61) 3329 2300	+55 (61) 3329 2369	http://www.gov.uk/government/world/brazil	press.brasilia@fco.gov.uk	Office Hours Mon-Thu: 08:30am to 12:30pm and 13:30pm to 16:45pm Fri: 08:30am to 12:30pm and13:30pm to 16:30pm
British Embassy	Phnom Penh, Cambodia	27-29 Street 75, Sangkat Srah Chak, Khan , Daun Penh, Phnom Penh 12201, Cambodia	City Phnom Penh	+855 (0) 23 427124	+855 (0) 23 427125	http://www.gov.uk/government/world/cambodia	britemb@online.com.kh	Office Hours Opening hours (local time GMT+07:00): Monday to Thursday, 8.15am to 4.45pm, Friday,8.15am to 1.15pm
British Embassy	Kabul Afghanistan	15th Street, , Roundabout Wazir Akbar Khan, PO Box 334, Kabul, Afghanistan	City Kabul	+93 (0) 700 102 000	+93 (0) 700 102 250	http://ukinafghanistan.fco.gov.uk	britishembassy.kabul@fco.gov.uk	Office Hours 8.30 am to 4.30 pm ( Sunday to Thursday) Passport applications are only accepted on Mondaysand Tuesdays (8.30 am to 11.30 am)
British High Commission	Singapore	100 Tanglin Road, Singapore 247919	City Singapore	(+65) 6424 4200		http://www.gov.uk/government/world/singapore	consular.singapore@fco.gov.uk	Office Hours Monday to Friday - 8:30am to 5:00pmCONSULARMonday to Friday - 9.00am to 12.00pmAdditional hours on Wednesday - 2.00pm to 3.00pmDetails We develop the important and longstanding relationship between the UK and Singapore. We provideconsular services to British nationals, answering over 11,000 enquiries yearly.
British Embassy	La Paz, Bolivia	Avenida Arce No.2732, La Paz, Bolivia	City La Paz	(591 2) 2433424	(591 2) 2431073	http://www.gov.uk/government/world/bolivia	BELaPaz@fco.gov.uk/consular.lapaz@fco.gov.uk	
British Embassy	Sofia, Bulgaria	9 Moskovska Street, Sofia 1000, Bulgaria	City Sofia	(+359) 2 933 9222	(+359) 2 933 9250	http://www.gov.uk/government/world/bulgaria	BritishEmbassySofia@fco.gov.uk	Office Hours Monday to Friday, 9am to 5pmDetails Consular e-mail address: consularsection.sofia@fco.gov.uk
British High Commission	Nairobi, Kenya	Upper Hill Road, P.O. Box 30465-00100, Nairobi, Kenya	City Nairobi	+254 (0)20 287 3000 / +254 (0)20 2844 000		http://www.gov.uk/government/world/kenya	Nairobi.Enquiries@fco.gov.uk	Office Hours Monday to Thursday: 7am to 4pm and Friday 7am to 1pmDetails Consular Email: consular.enquiries@fco.gov.uk Opening hours: Local time: Monday to Thursday:7:45am to 2pm Closed on Friday (except for emergencies)For Visa Enquiries Email: visacustomerservice.nairobi@fco.gov.ukFor Passport enquiries Email: Feedback.passportservices@fco.gov.uk Passport collection Opening hours:2pm to 3pm Tuesday and Thursday
British Embassy	San Jose, Costa Rica	Edificio Centro Colón, Paseo Colón and Streets 38 and 40	City San Jose	(506) 2258-2025	(506) 2233 9938	http://www.gov.uk/government/world/costa-rica	ukin.costarica@fco.gov.uk	Details Consular enquiries: consular.costarica@fco.gov.uk Apartado 815 - 1007 San Jose Costa Rica
British Embassy	Ljubljana, Slovenia	Trg republike 3, 1000 Ljubljana, Slovenia	City Ljubljana	+386 1 200 3910	+386 1 425 0174	http://www.gov.uk/government/world/slovenia	info@british-embassy.si	Details Consular office: consular.enquiriesljubljana@fco.gov.uk
British Consulate-General	Calgary, Canada	5100-150 6 Ave SW, Calgary Alberta T2P 3Y7, Canada	City Calgary	+1 403 705 1755	+1 403 538 0121		UKConsulate.Calgary@fco.gov.uk	Office Hours Monday to Friday 8:00am to 2:30pm (commercial enquires only)Details Emergency assistance for British nationals: +1 403 538 2181
British Trade & Cultural Office Taiwan		26F, President International Tower , No. 9-11, Song Gao Road, Xin Yin District Taipei 11073, Taiwan	City Taipei	+886 (2) 8758 2088	+886 (2) 8758 2050	http://https://www.gov.uk/government/world/taiwan	info.taipei@fco.gov.uk/bass.taipei@fco.gov.uk	Details Her Majesty's Government do not recognise Taiwan as a sovereign state and consequently have nodiplomatic relations with it. However, there are unofficial British commercial and cultural offices in Taiwan.
British Honorary Consul	Split, Croatia	Obala Hrvatskog Narodnog Preporoda , 10/III, 21000 Split, Croatia	City Split	+385 (1) 6009 100	+385 (1) 6009 298			Details If you are a British national in need of urgent consular assistance during this period, please call theembassy telenumber 00 385 1 600 9100.
Embassy of Great Britain	Turkmenistan	3rd Floor Office Building , Four Points Ak Altyn Hotel , 744001 Ashgabat, Turkmenistan	City Ashgabat	+993 12 36 34 62/64 or +99365 71 20 33	+99 312 363 465	http://www.gov.uk/government/world/turkmenistan	beasb@online.tm	Details If you are having difficulty with the main telenumber for the Embassy, please try any of thefollowing: +993 12 363463, 363464, 363466, 363498 or 363474; or +99365 7102033; or call the FCOSwitchboard in London on +44 (0)20 7008 1500 for assistance.
Embassy of The UK	Muscat, Oman	P O Box 185, 116 Mina Al Fahal, Muscat, Oman	City Muscat	+968 2460 9000	+968 2460 9010	http://www.gov.uk/government/world/oman	muscat.enquiries@fco.gov.uk	Office Hours Sunday to Thursday, 3:30am to 10:30am (7:30am to 2:30pm Local Time)Details If you need to visit the British Embassy for a consular issue, you may need to make an appointment.For all notarial and documentary services an online appointment has to be made in advance of your visit.Please visit the notarial and documentary services section for detailed guidance.Consular: Muscat.consular@fco.gov.uk
British Embassy	Ankara, Turkey	Sehit Ersan Caddesi No 46/A, Cankaya Ankara, Turkey	City Ankara	+90 312 455 33 44	+90 312 455 33 52	http://www.gov.uk/government/world/turkey	info.officer@fco.gov.uk/britembcon@fco.gov.uk	Details Our network of posts in Turkey, including the British Embassy in Ankara and our Consulate Generalin Istanbul, develop and maintain relations between the UK and Turkey. We work on a wide range of issuesincluding Turkey’s bid to join the European Union, the economy, energy policy and international security.
British Embassy	Santo Domingo, Dominican Republic	Ave 27 de Febrero No 233, Edificio Corominas Pepin, Santo Domingo, DR	City Santo Domingo	(001) (809) 472 7111	(001) (809) 472 7190	http://www.gov.uk/government/world/dominican-republic	brit.emb.sadom@codetel.net.do	Office Hours Monday to Thursday 8:00am to 1:00pm and 2:00pm to 4:30pm Friday 8:00am to 1:00pmDetails Please note that all Consular enquiries should be directed to the Consular Section: Monday toThurday 8:30am to 1:00pm (001) (809) 472 7111
British Consulate-General	Montreal, Canada	2000 McGill College Avenue , Suite 1940, Montreal Quebec H3A 3H3, Canada	City Montreal	+1 514 866 5863	+1 514 866 0202		rsvp.montreal@fco.gov.uk	Office Hours Monday to Friday 9:00am to 4:00pm (commercial enquires only)Details Please note that the British High Commission in Ottawa is the only mission within Canada that offersa Visa Service.
British Consulate-General	Toronto, Canada	777 Bay Street, Suite 2800, Toronto, Ontario M5G 2G2, Canada	City Toronto	+1 416 593 1290	+1 416 593 1229		britcon.toronto@fco.gov.uk	Office Hours GMT: Mon-Fri: 1400 - 2130 Local Time: Mon-Fri: 0900 - 1630Details Telephone: 9:00am to 4:00pm Monday to Friday (except public holidays). Emergency consularservice for British nationals is available out of hours. Public access is by appointment only.
British Consulate-General	Vancouver, Canada	1111 Melville Street, Suite 800, Vancouver British Columbia V6E 3V6, Canada	City Vancouver	+1 604 683 4421	+1 604 681 0693		britishconsulate.vancouver@fco.gov.uk	Office Hours GMT: Mon-Fri: 1630-0030 Local Time: Mon-Fri: 0830-1630Details Telephone: 9:00am to 4:00pm Monday to Friday (except public holidays). Emergency consularservice for British nationals is available out of hours. Public access is by appointment only.
British Embassy	Damascus, Syria	Kotob Building, 11 Mohammad Kurd Ali Street , Malki, P O Box 37, Damascus, Syria	City Damascus	(963) (11) 373 9241/2/3/7	(963) (11) 373 9472	http://www.gov.uk/government/world/syria	british.embassy.damascus@fco.gov.uk	Details The British Embassy Damascus has suspended all services and all diplomatic personnel have beenwithdrawn from Syria. Those who choose to remain in Syria or to visit against our advice should be awarethat we cannot provide consular assistance in country. Any British nationals requiring urgent consularassistance can visit the embassy of any EU Member State in Damascus, or in an emergency call the FCO inLondon on (+44) 20 7008 1500.
Embassy of the United Kingdom	Iran	British Embassy, 198, Ferdowsi Avenue , Tehran 11316-91144	City Tehran	+44 20 7008 1500		http://www.gov.uk/government/world/iran	margaret.mostoufi@fco.gov.uk	Details The British Embassy Tehran remains closed. If you need routine consular assistance in Iran youshould contact the Foreign and Commonwealth Office on +44 20 7008 1500. In an emergency, you shouldcontact any EU Embassy in Tehran including the Swedish Embassy.
British High Commission	Wellington, New Zealand	44 Hill Street Thorndon, Wellington 6011, New Zealand	City Wellington	+64 (0) 4 924 2888	+64 (0) 4 473 4982	http://www.gov.uk/government/world/new-zealand		Office Hours Monday to Friday - 9.00am to 5.00pmDetails The British High Commission in Wellington, together with the British Consulate-General inAuckland, represents the UK government in New Zealand. We are also here to support and protect UKinterests in Pitcairn Island and Samoa.24/03/2017 Overseas Embassies and Consulates of United Kingdomhttps://embassy.goabroad.com/embassies-of/united-kingdom 18/35
British Embassy	Taguig, Philippines	120 Upper McKinley Road, McKinley Hill, Taguig City 1634, Philippines	City Taguig City	+63 2 858 2200	+63 2 858 2313	http://www.gov.uk/government/world/philippines	ukinthephilippines@fco.gov.uk	Office Hours Monday to Friday - 8:00am to 4:45pmDetails The Philippines and the UK enjoy good relations as longstanding partners and allies. Both areoutward looking island nations committed to democracy, trade and investment, and support for the UnitedNations. As well as close government-to-government relations, the two nations have contacts at all levels ofcivil society. We are also here to support and protect UK interests in the Philippines and Palau.
British Embassy	Athens, Greece	1 Ploutarchou str, 106 75 Athens, Greece	City Athens	+30 210 7272 600		http://www.gov.uk/government/world/greece	information.athens@fco.gov.uk	Details The United Kingdom’s relationship with Greece goes back nearly two centuries, to the foundation ofthe modern Greek state – if not longer than that. Our two countries are partners and friends. Like the UK,Greece is a mature member of the European Union and of NATO, and much of our cooperation takes placewithin that framework.24/03/2017 Overseas Embassies and Consulates of United Kingdom
British Embassy	Tashkent, Uzbekistan	67 Gulyamov Street, Tashkent 100000, Uzbekistan	City Tashkent	+99 871 120 1500		http://www.gov.uk/government/world/uzbekistan	ukin.uzbekistan@fco.gov.uk	Office Hours GMT+5: Monday to Friday: 09.00 to 17.00 pmDetails Visa enquiries - www.ukvi-international.faq-help.comConsular enquiries - consular.tashkent@fco.gov.uk
British Embassy	Prague, Czech Republic	Thunovska 14 , Political, Defence Section, 118 00 Prague 1 , Czech Republic	City Prague	+420 257 40 2111	+420 257 40 2296	http://www.gov.uk/government/world/czech-republic	ukinczechrepublic@fco.gov.uk	Details We develop and maintain relations between Britain and the Czech Republic. We work on a widerange of issues including our mutual interests in the EU, NATO and the UN, increasing trade and investment,and developing our defence relationship.
British Embassy	Asuncion, Paraguay	Edificio Citicenter, Piso 5 , Av. Mariscal López y Cruz del Chaco, Asuncion, Paraguay	City Asuncion	+ 595 (21) 328 5507		http://www.gov.uk/government/world/paraguay	BE-Asuncion.Enquiries@fco.gov.uk	Office Hours Monday to Friday: 9:00am to 5:00pmDetails We develop and maintain relations between the UK and Paraguay. Our job is to work with the UKgovernment’s international agenda and support their foreign priorities.
British Embassy	Zagreb, Croatia	Ivana Lu?i?a 4, 10000 Zagreb, Croatia	City Zagreb	+385 (1) 6009 100	+385 (1) 6009 111	http://www.gov.uk/government/world/croatia	british.embassyzagreb@fco.gov.uk	Details We develop and maintain relations between the United Kingdom and Croatia. We are working withCroatia as a new partner and ally within the EU on bilateral, regional and global issues. For VISA enquiries:zagreb.visaenquiries@fco.gov.uk
British Embassy	Madrid, Spain	Torre Espacio , Paseo de la Castellana 259D, 28046 Madrid, Spain	City Madrid	+34 917 146 300	+34 917 146 301	http://www.gov.uk/government/world/spain	info.consulate@fco.gov.uk	Details We develop and maintain relations between the United Kingdom and Spain. We work on issuesincluding the economy, commercial regulation in the single market, energy policy and international security.(We also cover Andorra remotely.)
British Embassy	Warsaw, Poland	ul. Kawalerii 12, 00-468 Warsaw, Mazowieckie Poland	City Warsaw	+48 22 311 00 00	+48 22 311 03 13	http://www.gov.uk/government/world/poland	info@britishembassy.pl	Details We develop the important and longstanding relationship between the UK and Poland.
British Embassy	Vilnius, Lithuania	Antakalnio str. 2 , LT-10308 Vilnius , Lithuania	City Vilnius	+370 5 2462900	+370 5 2462901	http://www.gov.uk/government/world/lithuania	be-vilnius@britain.lt	Details We work to improve trade and investment between Britain and Lithuania, developing strong political,economic, cultural and defence ties.
British High Commission	Islamabad, Pakistan	Diplomatic Enclave, Ramna 5, P O Box 1122, Islamabad, Pakistan	City Islamabad	+92 51 201 2000		http://www.gov.uk/government/world/pakistan	Islamabad-general.enquiries@fco.gov.uk	Office Hours GMT: Mon-Thurs: 0300-1115Fri: 0300-0800.Local Time: Mon-Thurs: 0800-1615Fri: 0800-1300
British High Commission	Port Moresby, Papua New Guinea	Sec 411 Lot 1 & 2 , Kiroki Street, Wagani , National Capital District , Port Moresby, Locked Mail Bag 212	City Port Moresby	(+675) 325 1677	(+675) 325 3547	http://www.gov.uk/government/world/papua-new-guinea	uk.inpng@fco.gov.uk	Office Hours Monday to Thursday - 8.00am to 4.00pmFriday - 8.00am to 12.00pmPassports collection Monday - Friday 9.00am to 12.00pmDetails Papua New Guinea and the UK enjoy good relations as historic partners and allies. Both are outwardlooking Commonwealth nations committed to democracy, trade and investment, and support for the United
British Embassy	Kathmandu, Nepal	P.O. Box 106, Lainchaur, Kathmandu, Nepal	City Kathmandu	(977) (1) 4410583/4414588	(977) (1) 4411789/4416723	http://www.gov.uk/government/world/nepal	BEKathmandu@fco.gov.uk	Office Hours Monday to Thursday 0815 – 1230/1330 – 1700hrsFriday 0815 – 1315hrs
British Embassy	Panama City, Panama	MMG Tower, 4th Floor , Calle 53, Marbella , PO Box 0816-07946, Panama City	City Panama City	(507) 297 6550	(507) 297 6588	http://www.gov.uk/government/world/panama	britemb@cwpanama.net	Office Hours Monday to Thursday 7:30am to 4:30pmFriday 7:30am to 12:30pm
British Embassy	Tunis, Tunisia	Rue du Lac Windermere, Les Berges du Lac, Tunis 1053	City Tunis	+216 71 108 700	+216 71 108 749	http://www.gov.uk/government/world/tunisia	BritishEmbassyTunis@fco.gov.uk	Office Hours Monday to Thursday, 8.00am to 4.30pm (local time)Friday 8.00am to 1.00pm (local time)
British Embassy	Montevideo, Uruguay	Marco Bruto 1073, 11300 Montevideo, Uruguay	City Montevideo	(598) 2622 3630 or 2622 3650	(598) 2622 7815	http://www.gov.uk/government/world/uruguay	ukinuruguay@adinet.com.uy	Office Hours Monday to Thursday 9:00am to 1:00pm / 2:00pm to 5:30pmFriday 9:00am to 2:00pm
Consulate of United Kingdom	Chiang Mai, Thailand	198 Bumrungraj Rd, Muang, Chiang Mai 50000, Thailand	City Chiang Mai	+66 (0) 2 305 8333	(+66) (53) 263 016		ConsularEnquiriesChiangmai@fco.gov.uk	Office Hours Monday to Thursday, 8am to 4.30pmFriday, 8am to 1pm
Embassy of the United Kingdom	Seoul, South Korea	Sejong-daero 19-gil 24 , Jung-gu, Seoul , 100-120 South Korea	City Seoul	(+82) (2) 3210 5500	(+82) (2) 725 1738	http://www.gov.uk/government/world/south-korea	Enquiry.Seoul@fco.gov.uk	Office Hours Monday-Thursday: 09:00-12:30 / 13:30-17:15Friday: 09:00-12:30 / 13:30-17:00
British Deputy High Commission	Lagos, Nigeria	11 Walter Carrington Crescent, Victoria Island, Lagos, Nigeria	City Lagos	+ 234 (1) 277 0780/0781/0782			consular.lagos@fco.gov.uk/visa.lagos@fco.gov.uk	Office Hours Monday to Thursday: 8.30 am to middayFriday: 8.30 am to 11 am (GMT +1)
British Embassy	Hanoi, Vietnam	Central Building, 4th floor , 31 Hai Ba Trung , Hanoi, Vietnam	City Hanoi	+84 (0)4 3936 0500	+84 (0)4 3936 0561	http://www.gov.uk/government/world/vietnam	generalenquiries.vietnam@fco.gov.uk	Office Hours Monday to Thursday: 8.30am to 12.30pm and 1.30pm to 4.45pm Friday: 8.30am to 12.30pm and 1.00pm to 3.00pm
British High Commission	Abuja, Nigeria	19 Torrens Close, Mississippi, Maitama , Abuja, Nigeria	City Abuja	+234 (9) 4622200	+234(9) 4622263	http://www.gov.uk/government/world/nigeria	PPAInformation.abuja@fco.gov.uk/Abuja.visacustomercare@fco.gov.uk	Office Hours Monday - Thursday: 8am-4pm. Friday: 8am-1pm
British Embassy	Amman, Jordan	(PO Box 87) Abdoun , Amman, 11118, Jordan	City Amman	+962 (6) 590 9200	+962 (6) 590 9279	http://www.gov.uk/government/world/jordan	Amman.enquiries@fco.gov.uk	Office Hours Sunday to Wednesday, 6am to 1pm GMT (8am to 3:30pm local time) Thursday, 6am to 1pm GMT (8am to 3pm local time)
British Embassy	Copenhagen, Denmark	Kastelsvej 36-40, DK-2100 Copenhagen, Denmark	City Copenhagen	+45 35 44 52 00		http://www.gov.uk/government/world/denmark	Enquiry.Copenhagen@fco.gov.uk	Office Hours British Embassy: Monday to Friday from 09:00 to 17:00 Government & Public Affairs: Monday to Friday from 09:00 - 17:00Details Consular / passport enquiries: consular.copenhagen@fco.gov.uk
British High Commission	Pretoria, South Africa	255 Hill Street, Arcadia 0002, Pretoria, South Africa	City Pretoria	+27 12 421 7500	+27 12 421 7599	http://www.gov.uk/government/world/south-africa	pta.assistanceforbritishnationals@fco.gov.uk	Office Hours GMT: Mon-Thurs: 0600-1500 Fri: 0600-1030Local Time: Mon-Thurs: 0800-1700 Fri: 0800-1230Details We develop and maintain relations between the United Kingdom and South Africa. The HighCommission also covers Lesotho and Swaziland.We deal with a wide range of political, commercial, security and economic questions of interest to the UKand South Africa. The High Commission, and our consulate in Cape Town, provide consular assistance toBritish nationals in South Africa.
British Embassy	Abu Dhabi, United Arab Emirates	Khalid bin Al Waleed St (Street 22), PO Box 248 , Abu Dhabi, United Arab Emirates	City Abu Dhabi	+971 2 610 1100	+971 2 610 1585	http://www.gov.uk/government/world/united-arab-emirates	consular.UAE@fco.gov.uk	Office Hours GMT: Sunday - Thursday: 0330-1030Local Time: Sunday - Thursday: 0730-1430
British Embassy	Beirut, Lebanon	Serail Hill, Embassy Complex , PO Box : 11- 471 Beirut Central District, Lebanon	City Beirut	+961 (0)1 960800	+961 (0)1 960855	http://www.gov.uk/government/world/lebanon		Office Hours Monday to Thursday, 6am to 2pm; Friday 6am to 12pm (GMT)Monday to Thursday, 8am to 4pm, Friday 8am to 2pm (Local Time)Details Visa enquiries: visa.beirut@fco.gov.ukConsular section: consular.beirut@fco.gov.uk
British Embassy	Lima, Peru	Torre Parque Mar (22nd Floor) , Avenida José Larco, 1301 , Miraflores, Lima, Peru	City Lima	+51 1 617 3000	+51 1 617 3100	http://ukinperu.fco.gov.uk/en/about-us/our-embassy/contact-us/	belima@fco.gov.uk	Office Hours Visa section opening times: From Monday to Friday from 8:00 to 12:00Passport collection times: From Monday to Friday from 12:00 to 12:30Details The British Embassy in Lima represents the British government and manages various strands of therelationship between the UK and Peru.For any emergency involving a British citizen during holidays or out-of-office-hours, please contact (51-1)6173000 and your call will be properly re-directed.
British Embassy	Dubai, United Arab Emirates	Al Seef Road , Bur Dubai (near to Dubai Creekside), PO Box 65 United Arab Emirates	City Dubai	+971 4 309 4444	+971 4 309 4301	http://www.gov.uk/government/world/united-arab-emirates	consular.UAE@fco.gov.uk	Office Hours Sunday to Thursday, 7:30am to 2:30pm (Local)Sunday to Thursday, 4:30am to 11:30am (GMT)
British Embassy	Moscow, Russian	121099 Moscow, Smolenskaya Naberezhnaya 10, Russia	City Moscow	+7 495 956 7200	+7 495 956 7481	http://www.gov.uk/government/world/russia	ukinrussia@fco.gov.uk	Office Hours The British Embassy is open Monday to Friday 9am to 1pm and 2pm to 5pm.The Consular section is open 9am to 12pm (except public holidays).Details All consular services by appointment only. Please book your appointment online.
British Embassy	Buenos Aires, Argentina	Dr Luis Agote 2412 (1425), Buenos Aires, Argentina	City Buenos Aires	+54 11 4808-2200	+54 11 4808-2274	http://www.gov.uk/government/world/argentina	askinformation.baires@fco.gov.uk	Office Hours Open to the public: Monday to Friday 9am to 1pm. Office hours: Monday to Thursday: 8:45amto 5:30pm; Friday: 8:45am to 2:00pm. See Access and opening times to make an appointment for notarialservices.
British Consulate-General	Houston, United States	1301 Fannin St,, Suite 2400, Houston TX 77002 USA		+1 713 210 4000		http://https://www.gov.uk/world/usa		Office Hours By appointment only
British Consulate	Miami, United States	1001 Brickell Bay Drive, Miami FL 33131, United States		+1 305 400 6400		http://https://www.gov.uk/world/usa		Office Hours By appointment only
British Consulate-General	Boston, United States	One Broadway Cambridge, Massachusetts 02142		+1 617 245 4500		http://https://www.gov.uk/world/usa		Office Hours By appointment only
British Consulate-General	Chicago, United States	625 N Michigan Avenue, Suite 2200, Chicago IL 60611, USA		+1 312 970 3800		http://https://www.gov.uk/world/usa		Office Hours By appointment only
British Consulate-General	New York, United States	845 Third Avenue, New York, NY 10022, United States	City New York	+1 212 745 0200		http://https://www.gov.uk/world/usa/		Office Hours By appointment only
British Embassy	Washington D.C. United States	3100 Massachusetts Avenue, Washington DC, 20008 United States		+1 202 588 6500		http://https://www.gov.uk/world/usa	britishembassyenquiries@gmail.com	Office Hours By appointment only
British Embassy	Bratislava, Slovakia	Panska 16, 811 01 Bratislava, Slovakia	City Bratislava	+421 2 5998 20 00	+421 2 5998 22 37	http://www.gov.uk/government/world/slovakia	bebra@internet.sk/bratislava.consularenquiries@fco.gov.uk	Office Hours By appointment only.
British Embassy Liaison Office	Bujumbura	Building Old East Bujumbura, 1st Floor, Place de L’Independence, Bujumbura, Burundi	City Bujumbura	+257 22 24 64 78 / + 257 22 25 03 66		http://www.gov.uk/government/world/burundi	BHC.Kigali@fco.gov.uk	Office Hours Monday - Thursday : 800-1230 / 1400- 1730 Friday : 800-1200
British Embassy	Baku, Azerbaijan	45 Khagani Street, AZ1010 Baku, Azerbaijan	City Baku	+ 994 (12) 4377878	+ 994 (12) 4977434	http://www.gov.uk/government/world/azerbaijan	generalenquiries.baku@fco.gov.uk	Office Hours Monday to Friday 5am - 1pm GMT 9am - 5pm Local Time
British High Commission	Ottawa, Canada	80 Elgin Street, Ottawa Ontario K1P 5K7, Canada	City Ottawa	+1 613 237 1530	+1 613 232 0738	http://www.gov.uk/government/world/canada	ukincanada@fco.gov.uk	Office Hours Monday to Friday 8:30am to 5:00pm
British Consulate-General	Auckland, New Zealand	Level 17 Auckland, 151 Queen Street 1142, New Zealand	City Auckland	+64 (0) 9 303 2973				Office Hours Monday to Friday 9.00am to 1.00pm
British Consulate-General	Brisbane, Australia	Level 9, 100 Eagle Street , Brisbane QLD 4000, Australia	City Brisbane	+61 (0)7 3223 3200				Office Hours Monday to Friday 9.00am to 5.00pm
British Consulate-General	Melbourne, Australia	17th Floor, 90 Collins Street, Melbourne 3000, Victoria, Australia	City Melbourne	+61 (0)3 9652 1600				Office Hours Monday to Friday 9.00am to 5.00pm
British Embassy	Beijing, China	11 Guang Hua Lu, Jian Guo Men Wai, Beijing, 100600 China	City Beijing	+86 (0) 10 5192 4000	+86 (0) 10 5192 4239	http://www.gov.uk/government/world/china		Office Hours Monday to Friday, 8:30am to midday / 1:30pm to 5pm (Local time)
British High Commission	Canberra, Australia	Commonwealth Avenue, Yarralumla, Canberra , Australia	City Canberra	+61 (0)2 6270 6666	+61 (0)2 6273 3236	http://www.gov.uk/government/world/australia	australia.enquiries@fco.gov.uk	Office Hours Monday to Friday, 8.45am to 12.30pm/1.30pm to 5.00pm
British Embassy	Berlin, Belgium	Wilhelmstraße 70/71, 10117 Berlin, Germany	City Berlin	+49 (0) 30 204 570		http://www.gov.uk/government/world/germany	ukingermany@fco.gov.uk	Office Hours Monday to Friday, 9am to 5.30pm
British Embassy	Yerevan, Armenia	34 Baghramyan Avenue, Yerevan 0019, Armenia	City Yerevan	+374 10 264301	+374 10 264318	http://www.gov.uk/government/world/armenia	enquiries.yerevan@fco.gov.uk	Office Hours Monday to Friday, 9am to 5pm
British Consulate-General	Sydney, Australia	Level 16, Gateway Building, 1 Macquarie Place, Sydney, NSW 2000 Australia	City Sydney	+61 (0)2 9247 7521		http://www.gov.uk/government/world/australia		Office Hours Monday to Friday: 9.00am to 12.30pm/1.30pm to 5.00pm
British Embassy	Asmara, Eritrea	66-68 Mariam Ghimbi Street , Zip Code 174 , PO Box 5584 , Asmara, Eritrea	City Asmara	+ 291 1 20 28 39	+ 291 1 12 01 04	http://www.gov.uk/government/world/eritrea	Asmara.Enquiries@fco.gov.uk	Office Hours Monday to Thursday (Local Time) 8am - 4:30pm Friday 8am - 12:30pm
